{
  "schemaVersion" : "matching.m12.coverage.v1",
  "status" : "PASS",
  "executionScope" : "REAL_AERON_CHILD_PROCESSES",
  "clusterEvidenceQualified" : true,
  "scopeDisclosure" : "ASSERTIONS_RECOMPUTED_FROM_REAL_AERON_CHILD_PROCESS_TRACE",
  "source" : "EXECUTED_ASSERTION_WITNESS_LEDGER",
  "witnessContract" : "M12_EXECUTED_ASSERTION_WITNESS_V1",
  "labelsAcceptedWithoutWitness" : false,
  "required" : 25,
  "observed" : 25,
  "assertionsExecuted" : 25,
  "allAssertionsPassed" : true,
  "systemErrorsEvaluatedAfterControls" : true,
  "ledgerVerifiedAgainstExecutionReplay" : true,
  "semanticDigest" : "a94bccba4baee2339ddaf525c4251c051f7ad3e48021fd50ceb2ed59f4ffe4df",
  "ledgerSha256" : "ba8539bde54ed32e79106691c3b811f3474b890df769531063c1492d9369712a",
  "factLedger" : [ {
    "obligation" : "THREE_REAL_MEMBERS",
    "scenarioId" : "THREE_REAL_MEMBERS_INITIAL_ELECTION",
    "sourceArtifact" : "m12-command-history.json",
    "assertionId" : "M12.THREE_REAL_MEMBERS_INITIAL_ELECTION.THREE_REAL_MEMBERS.V1",
    "producer" : "M12HistoryJudge#assertObligation(THREE_REAL_MEMBERS)",
    "assertion" : "three independently owned member observations with distinct positive PIDs",
    "observedValue" : "scope=REAL_AERON_CHILD_PROCESSES,memberIds=[0, 1, 2],pids=[38707, 38708, 38709]",
    "observationSha256" : "980cbc7feb2bc73d06ecd7e1c039dfc1b0911addc22671eb7ae9a7bac4d285fa",
    "witnessSha256" : "fd94b543782f2f79eacfda34fd163f689d5f491f3b11c52d4cbb64129f3ef4d4",
    "executed" : true,
    "passed" : true
  }, {
    "obligation" : "SINGLE_INITIAL_LEADER",
    "scenarioId" : "THREE_REAL_MEMBERS_INITIAL_ELECTION",
    "sourceArtifact" : "m12-command-history.json",
    "assertionId" : "M12.THREE_REAL_MEMBERS_INITIAL_ELECTION.SINGLE_INITIAL_LEADER.V1",
    "producer" : "M12HistoryJudge#assertObligation(SINGLE_INITIAL_LEADER)",
    "assertion" : "the initial topology has exactly one Leader and two Followers",
    "observedValue" : "leader=2,term=0",
    "observationSha256" : "f5a0c7bb514749f986419001bfe1e577720f1c66d94833ea643657869158a3ed",
    "witnessSha256" : "c35f5ec44563109c5a75fc2db9d554276eb6be6531402f16353e3397014ae24a",
    "executed" : true,
    "passed" : true
  }, {
    "obligation" : "DISJOINT_MEMBER_OWNERSHIP",
    "scenarioId" : "THREE_REAL_MEMBERS_INITIAL_ELECTION",
    "sourceArtifact" : "m12-command-history.json",
    "assertionId" : "M12.THREE_REAL_MEMBERS_INITIAL_ELECTION.DISJOINT_MEMBER_OWNERSHIP.V1",
    "producer" : "M12HistoryJudge#assertObligation(DISJOINT_MEMBER_OWNERSHIP)",
    "assertion" : "member directories and five-port blocks are pairwise disjoint",
    "observedValue" : "0@base=52100:ports=[52101, 52102, 52103, 52104, 52105],1@base=52110:ports=[52111, 52112, 52113, 52114, 52115],2@base=52120:ports=[52121, 52122, 52123, 52124, 52125]",
    "observationSha256" : "153a5314b088f3e977c72ad52aa231e645088c8223cec4d7e56df38aa822782a",
    "witnessSha256" : "73946ad7bb5770548efbd037dbc2adc3667024f982b5bb043a52037082c99948",
    "executed" : true,
    "passed" : true
  }, {
    "obligation" : "CORRELATED_APPLY_ACK",
    "scenarioId" : "CORRELATED_RESPONSE_IS_ACK",
    "sourceArtifact" : "m12-command-history.json",
    "assertionId" : "M12.CORRELATED_RESPONSE_IS_ACK.CORRELATED_APPLY_ACK.V1",
    "producer" : "M12HistoryJudge#assertObligation(CORRELATED_APPLY_ACK)",
    "assertion" : "every acknowledgement is ingress-accepted and carries its invocation correlation",
    "observedValue" : "acknowledged=82,correlationsExact=true",
    "observationSha256" : "5d6f228e3e8328258980e52a2190cbe0449ec2e3a30b5ed2ee500dd8c7593400",
    "witnessSha256" : "0669e32b9438ef4f3678c1322934b00df871756e3973234d456e4670ee29ba12",
    "executed" : true,
    "passed" : true
  }, {
    "obligation" : "M11_PROTOCOL_UNCHANGED",
    "scenarioId" : "CORRELATED_RESPONSE_IS_ACK",
    "sourceArtifact" : "m12-command-history.json",
    "assertionId" : "M12.CORRELATED_RESPONSE_IS_ACK.M11_PROTOCOL_UNCHANGED.V1",
    "producer" : "M12HistoryJudge#assertObligation(M11_PROTOCOL_UNCHANGED)",
    "assertion" : "the harness reports the frozen M11 request and response protocol unchanged",
    "observedValue" : "m11ProtocolUnchanged=true",
    "observationSha256" : "4f57de29b70b361aecea9f77101c7ef743067f73449e4b5b7c4121ac8af97f42",
    "witnessSha256" : "8cea7ac1050779de115cd201bfc16de96fbbbf3f84206102d6bbe94176acc006",
    "executed" : true,
    "passed" : true
  }, {
    "obligation" : "INGRESS_OFFER_NOT_ACK",
    "scenarioId" : "INGRESS_OFFER_IS_NOT_ACK",
    "sourceArtifact" : "m12-command-history.json",
    "assertionId" : "M12.INGRESS_OFFER_IS_NOT_ACK.INGRESS_OFFER_NOT_ACK.V1",
    "producer" : "M12HistoryJudge#assertObligation(INGRESS_OFFER_NOT_ACK)",
    "assertion" : "an accepted ingress offer without a trusted response remains UNKNOWN",
    "observedValue" : "acceptedUnknown=2",
    "observationSha256" : "d3ccb8ad345ef85854d640b5f89f19c55ed876b48c8615248946a6b47e1340ab",
    "witnessSha256" : "0dede143337cbc359729f28cb51ebb305402898ecb594043b18bd72bc428f223",
    "executed" : true,
    "passed" : true
  }, {
    "obligation" : "PRE_OFFER_NOT_SUBMITTED",
    "scenarioId" : "PRE_OFFER_IS_NOT_SUBMITTED",
    "sourceArtifact" : "m12-command-history.json",
    "assertionId" : "M12.PRE_OFFER_IS_NOT_SUBMITTED.PRE_OFFER_NOT_SUBMITTED.V1",
    "producer" : "M12HistoryJudge#assertObligation(PRE_OFFER_NOT_SUBMITTED)",
    "assertion" : "a command not accepted by ingress is NOT_SUBMITTED",
    "observedValue" : "notSubmitted=1",
    "observationSha256" : "acb3eac6c5c0aa891b8399e7e89903ddb9b298951c88239339e5f48f8947c51b",
    "witnessSha256" : "8a787b06aaf75e4997551a011cabb9b66a0db3b7e75da0b84670369efb015504",
    "executed" : true,
    "passed" : true
  }, {
    "obligation" : "AFTER_OFFER_UNKNOWN",
    "scenarioId" : "APPLIED_RESPONSE_UNOBSERVED_IS_UNKNOWN",
    "sourceArtifact" : "m12-command-history.json",
    "assertionId" : "M12.APPLIED_RESPONSE_UNOBSERVED_IS_UNKNOWN.AFTER_OFFER_UNKNOWN.V1",
    "producer" : "M12HistoryJudge#assertObligation(AFTER_OFFER_UNKNOWN)",
    "assertion" : "accepted invocations without trusted responses are UNKNOWN and not rejected",
    "observedValue" : "acceptedUnknown=2,timeoutRejected=false",
    "observationSha256" : "c7739658f1add9192a687f5dbb9bafab343b099d3f153ed4ea5bce8a17eb7529",
    "witnessSha256" : "cbd465495ea1b013c7af33213e29a4075aeded9e209071b0aa2f8183bc8d8db4",
    "executed" : true,
    "passed" : true
  }, {
    "obligation" : "SAME_IDENTITY_RETRY",
    "scenarioId" : "UNKNOWN_RETRY_SAME_IDENTITY",
    "sourceArtifact" : "m12-command-history.json",
    "assertionId" : "M12.UNKNOWN_RETRY_SAME_IDENTITY.SAME_IDENTITY_RETRY.V1",
    "producer" : "M12HistoryJudge#assertObligation(SAME_IDENTITY_RETRY)",
    "assertion" : "every retry preserves exact canonical envelope bytes and uses a fresh correlation",
    "observedValue" : "retries=18,byteExact=true,freshCorrelations=true",
    "observationSha256" : "16003cb4c078323648a63a1ba532c0ed6d4b39672d2f6452e81c947672e3155a",
    "witnessSha256" : "2362baa5eb9f3d4cdd3c8eb7072949046f9d3ba9db6d96b76d5a36d13d9cb0c6",
    "executed" : true,
    "passed" : true
  }, {
    "obligation" : "ORIGINAL_RESULT_REPLAY",
    "scenarioId" : "UNKNOWN_RETRY_SAME_IDENTITY",
    "sourceArtifact" : "m12-command-history.json",
    "assertionId" : "M12.UNKNOWN_RETRY_SAME_IDENTITY.ORIGINAL_RESULT_REPLAY.V1",
    "producer" : "M12HistoryJudge#assertObligation(ORIGINAL_RESULT_REPLAY)",
    "assertion" : "duplicate acknowledgements replay the originally bound sequence and result digest",
    "observedValue" : "duplicateReplays=18,noQuorumBranch=DUPLICATE_REPLAYED,exact=true",
    "observationSha256" : "4547b58bfa5f866a749a0d5a5adf2847eb80a72d795dca0c3c78d1c1a7495771",
    "witnessSha256" : "0788589901fc3d50237f22fddfa4df2809de70fe4623ea9634ca8245b41a322b",
    "executed" : true,
    "passed" : true
  }, {
    "obligation" : "ONE_EFFECT_PER_IDENTITY",
    "scenarioId" : "UNKNOWN_RETRY_SAME_IDENTITY",
    "sourceArtifact" : "m12-command-history.json",
    "assertionId" : "M12.UNKNOWN_RETRY_SAME_IDENTITY.ONE_EFFECT_PER_IDENTITY.V1",
    "producer" : "M12HistoryJudge#assertObligation(ONE_EFFECT_PER_IDENTITY)",
    "assertion" : "all 66 durable identities bind exactly one application sequence and one business effect",
    "observedValue" : "identities=66,bindings=66,effectCount=66,nextApplicationSequence=67",
    "observationSha256" : "cd1451c1c5baa12a35cbc44aa4bcd382c683e675aecf09fe0cf85f916af0f170",
    "witnessSha256" : "9485a48c213989d46b026f9aca3c7d4530085dda15b94155adb7f411c3ddce31",
    "executed" : true,
    "passed" : true
  }, {
    "obligation" : "EXTERNAL_LEADER_KILL",
    "scenarioId" : "LEADER_KILL_AND_REPLACEMENT_ELECTION",
    "sourceArtifact" : "m12-command-history.json",
    "assertionId" : "M12.LEADER_KILL_AND_REPLACEMENT_ELECTION.EXTERNAL_LEADER_KILL.V1",
    "producer" : "M12HistoryJudge#assertObligation(EXTERNAL_LEADER_KILL)",
    "assertion" : "the selected fault target was the observed current Leader and the controller was external",
    "observedValue" : "killedMember=2,external=true",
    "observationSha256" : "077a3831f14430c47cf28bff4fa2d6d0066beff1bcd9cb1f83f7198734c23f76",
    "witnessSha256" : "67a0f76097a69623f8b894d9e433d9195030dad01757f048d146ee077557be27",
    "executed" : true,
    "passed" : true
  }, {
    "obligation" : "NEW_LEADER_ELECTED",
    "scenarioId" : "LEADER_KILL_AND_REPLACEMENT_ELECTION",
    "sourceArtifact" : "m12-command-history.json",
    "assertionId" : "M12.LEADER_KILL_AND_REPLACEMENT_ELECTION.NEW_LEADER_ELECTED.V1",
    "producer" : "M12HistoryJudge#assertObligation(NEW_LEADER_ELECTED)",
    "assertion" : "a different voting member became the replacement Leader",
    "observedValue" : "initial=2,replacement=0",
    "observationSha256" : "dc378a0ecf24f675ba217c2402bda6f40228cdbe844330cda0341c3957b760d9",
    "witnessSha256" : "357062912c80d8ec62e21fe6b0d9d5d52aeda2d671f8732b9f081e3b268826ab",
    "executed" : true,